from https://youtu.be/vzbVFoKg8eM?t=7301 to https://youtu.be/vzbVFoKg8eM?t=10901,,,,,
start_time,end_time,reason,start_time,end_time,reason
https://youtu.be/vzbVFoKg8eM?t=7683,https://youtu.be/vzbVFoKg8eM?t=7741,崖や水面が一部見えない、ゲームの世界の端のような場所に入り込んだと思われるため,https://youtu.be/vzbVFoKg8eM?si=UCvXk-GHtLYEuq21&t=7678,https://youtu.be/vzbVFoKg8eM?si=0y__BnttD2g7alk7&t=7743,床抜けをして、道ではない場所を移動している。
https://youtu.be/vzbVFoKg8eM?t=8516,https://youtu.be/vzbVFoKg8eM?t=8572,上記と同様、本来では入れないと思われる空間に入ったため。また、見た目では地面がないところを歩いており、降りれなくなっていたため。,https://youtu.be/vzbVFoKg8eM?si=uv7_7Vii4NrtbEiB&t=8049,https://youtu.be/vzbVFoKg8eM?si=DW7ak7O9BlLaKB3U&t=8080,正規の行き方ではないし、普通にやってもこんなに飛ぶことはない。
,,,https://youtu.be/vzbVFoKg8eM?si=pjQKonytRFszBbuG&t=8514,https://youtu.be/vzbVFoKg8eM?si=YiVQR-NaApCxy-cX&t=8556,床抜けをしている。
,,,https://youtu.be/vzbVFoKg8eM?si=Bna27zXaPuhfrswz&t=8559,https://youtu.be/vzbVFoKg8eM?si=SNNVzX4Us-Kf2_6L&t=8576,挙動がおかしい。
,,,https://youtu.be/vzbVFoKg8eM?si=uX76RRLmDxZYtaxB&t=8583,https://youtu.be/vzbVFoKg8eM?si=TL76W9xoVFOkwD67&t=8635,床抜けをして、道ではない場所を移動している。